titre,date,extrait
Faire face aux défis du marché du travail,2021-06-30,"La caractéristique principale du marché du travail marocain, c’est que la création d’emplois reste clairement insuffisante. Un rapport sur le suivi de la situation économique au Maroc a été pré"
"Le Maroc a su profiter de la crise, selon la banque mondiale",2021-06-30,"La Banque mondiale met en garde le Maroc sur les risques liés à la propagation mondiale de nouveaux variants de coronavirus plus infectieux, aux contraintes d’approvisionnement qui affectent la ca"
Holmarcom Insurance Activities ouvre son capital à l'IFC,2021-06-30,"D’après le groupe marocain, ce partenariat avec la Société financière internationale (IFC) lui permettra d’accélérer sa croissance dans le secteur de l’assurance et de renforcer son positionnement"
La dette publique atteint des niveaux alarmants: La bombe à retardement,2021-06-30,"Faute de vision, le gouvernement continue d’endetter le pays. En 2020 et 2021, la dette globale publique a pulvérisé tous les records. L’inquiétant, c’est que cet endettement sert uniquement à com"
Le pouvoir d’achat des ménages au plus bas,2021-06-30,Le surendettement provoque forcément un affaiblissement du pouvoir d’achat des Marocains. Une situation qui n’arrange pas l’économie marocaine dans le sens où ce faible pouvoir d’achat fragilise l
"Ahmed Azirar: ""La classe moyenne risque gros s’il y a un dérapage de l’endettement""",2021-06-30,"Le rythme de l’endettement s’est accéléré ces dernières années, surtout en période de Covid-19. Un rythme qui interpelle, notamment, sur l’affectation des emprunts, selon Ahmed Azirar, économiste,"
Le Maroc expose à Yaoundé son expertise en logements abordables,2021-06-30,"Le Maroc a pris part, mardi 22 juin 2021, aux travaux de la table ronde des ministres africains en charge de l’Habitat, du développement urbain et des finances, qui s’est tenue via visioconférence"
Maroc Telecom recèle encore du potentiel de croissance,2021-06-30,"Malgré un contexte concurrentiel de plus en plus féroce et après deux années successives 2019 et 2020 marquées par des éléments exceptionnels, le résultat net de l’opérateur devrait clôturer en ha"
"La relance, quelles priorités?",2021-06-30,"Pour l’AEI, compte tenu des ressources limitées de notre pays, Il est plus que jamais nécessaire de faire des choix courageux de nos premières priorités sectorielles et territoriales. Dans un c"
Prévisions de Bank Al-Maghrib: Belles perspectives pour l’économie marocaine,2021-06-30,"Le Maroc devrait réaliser une croissance de 5,3% en 2021, notamment grâce au développement des activités agricoles, d’après les prévisions de Bank Al-Maghrib. Après avoir subi les contrecoups d"
La croissance fera du surplace cette année par rapport à 2020,2021-06-30,"Le Centre marocain de conjoncture a recommandé une adaptation de la stratégie industrielle du Maroc pour se positionner après la pandémie du Covid-19, en développant les facteurs d’attractivité po"
Les députés fustigent Elalamy,2021-06-30,"Le ministre de l’industrie et de commerce, Moulay Hafid Elalamy, a dû affronter la colère des députés qui, los d’une séance parlementaire, lundi 21 juin 2021, ont vivement critiqué le retard qu’ac"
Expo Dubaï 2021: Une formidable vitrine universelle pour le Maroc,2021-06-29,"Le Maroc met les bouchées doubles pour réussir sa participation à l’Exposition Universelle Dubaï 2020, qui devait se tenir l’année dernière mais a été reportée en raison de la crise sanitaire. Le"
"Le groupe alliances lance une nouvelle marque immobilière, alliances résidences",2021-06-29,"Le groupe immobilier Alliances commence à sortir véritablement la tête de l’eau. Et ce après une période difficile connue il y a quelques années, notamment son endettement explosif. Désormais, le"
CONVENTION ENTRE LE GROUPE OCP ET LA SFI,2021-06-28,Le groupe OCP et la Société Financière internationale (IFC) ont signé une convention de financement d’un montant de 100 millions de dollars qui permettra au premier producteur mondial de phosphate
L’AUTONOMIE DES FEMMES PAR L’ENTREPRENEURIAT,2021-06-25,"On ne peut aboutir à la prospérité et au développement durable qu’en garantissant les droits des femmes et en assurant l’égalité. L’Organisation du Monde Islamique pour l’Éducation, les Science"
"Le Maroc, terre d’opportunités",2021-06-24,"Le Royaume a montré une grande capacité d’adaptation et une forte réactivité, qui, associées à une stratégie de relance alliant les secteurs public et privé, laissent entrevoir un rebond de l’écon"
"En 2030, 100% de l'eau utilisée par OCP proviendra de sources non conventionnelles",2021-06-24,"La mission de l’OCP, centrée sur l’humain et qui vise à nourrir le monde, ne peut se faire sans une véritable stratégie de développement durable. Lors d’un webinaire organisé le 10 juin 2021 pa"
La hausse des prix des matières premières plombe les finances publiques,2021-06-24,"Outre le poids financier considérable sur les finances publiques, l’importante hausse des matières premières a tendance également à peser sur les prix de certains produits non subventionnés comme"
La relance économique n’est pas pour demain,2021-06-24,"Point de relance économique sans investissement. En ces temps de crise où le budget de l’Etat devient maigre, les dépenses d’investissement baissent et celles de fonctionnement augmentent. Crise o"
"Entretien avec Soufiane Zegzouti, PDG de Galaxy voyage",2021-06-24,"Malgré toutes les difficultés rencontrées pendant la période de la crise sanitaire, le patron de Galaxy Voyage, Soufiane Zegzouti, affiche un optimisme béat par rapport à l’avenir du tourisme nati"
Retour des MRE: Les professionnels du tourisme en ordre de bataille,2021-06-24,"La Confédération nationale du tourisme a tenu une réunion, le 14 juin, afin de mettre en place la stratégie d’accueil des MRE pendant la saison estivale 2021, en particulier la politique tarifaire"
"Les baisses des prix des billets coûteront 4,5 MMDH à l’état",2021-06-23,"Les aéroports marocains ont pu traiter avec succès un flux de 180.000 voyageurs, dont 64% arrivés dans une période ne dépassant pas une semaine, un flux qui connaîtra une augmentation croissante d"
La microfinance va évoluer vers un système de banque universelle,2021-06-23,"Du nouveau pour l’activité du microcrédit au Maroc. La Chambre des représentants a adopté à l’unanimité, mardi 22 juin 2021 en séance plénière, le projet de loi relatif au microcrédit. Le projet d"
Produits de la mer : construction de deux usines à Tanger et Fnideq,2021-06-22,"L’entreprise britannique Sykes Seafood et Klaas Puul Beheer (Pays-Bas) prévoient de construire deux nouvelles usines, dans le Nord du Maroc, qui seront spécialisées dans les produits de la mer, du"
Les régionales de l'investissement posent leurs valises à Tanger,2021-06-22,"La tournée des «Régionales de l’investissement», un roadshow dédié à la relance économique des régions du Maroc, a fait escale récemment à Tanger. La 6e étape de cette tournée, initiée par le grou"
Entrepreneuriat : Accompagnement des porteurs de projets de M’DIQ-Fnideq,2021-06-22,"Les Journées portes ouvertes au profit des porteurs de projets ont choisi la préfecture de M’diq- Fnideq pour leur 4e escale, ce lundi 21 juin 2021. Organisé par le Centre régional d’investissemen"
L'écosystème de l'UM6P met en vitrine 13 startups et 4 solutions marocaines,2021-06-22,"Au niveau du Groupe OCP, deux solutions innovantes ont été mises en avant à “Viva Tech”, le plus grand salon de technologie sous format hybride. La cinquième édition «Viva Technology » (VivaTec"
Plan Maroc mines 2021-2030: Impulser une nouvelle dynamique,2021-06-22,"OEuvrer pour une industrialisation intégrée et durable, découvrir de nouveaux gisements et optimiser la valeur ajoutée des substances minérales exploitées. Le Plan Maroc Mines (PMM) 2021-2030,"
Un engagement pour la relance du tourisme national,2021-06-21,"Le leader de l’investissement touristique, Madaëf, filiale du groupe CDG, s’apprête à ouvrir six nouvelles unités hôtelières d’ici la fin de l’année 2021, contribuant, ainsi, à la relance du secte"
Une relance des IDE en 2021 face à des perspectives incertaines,2021-06-21,La réussite de la campagne nationale de de vaccination et les mesures de soutien gouvernementales devraient permettre d’attirer de nouveau les investissements directs étrangers. Ces derniers devra
La Banque mondiale accorde un prêt de 450 millions de dollars au Maroc,2021-06-18,"Le programme vise également à favoriser des solutions de financement innovantes, telles que le financement participatif, un secteur émergent dans lequel le Maroc figure parmi les leaders au Moyen-"
La dépréciation de la lire turque face au dirham pénalise le textile marocain,2021-06-16,"Les baisses successives de la lire turque sur le marché des changes font craindre une nouvelle perte de compétitivité du secteur textile marocain face à la forte concurrence turque. En un an, l"
Vers une économie de l'hydrogène vert,2021-06-16,"Explorer davantage les bénéfices socio-économiques des énergies renouvelables, en mettant l’accent sur le développement de nouvelles chaînes de valeur et la création d’emplois. Un accord de par"
Les projets d’investissement dans le secteur de l'agroalimentaire AU se multiplient au Maroc,2021-06-16,"C’est à travers une offre de bonne qualité et de produits innovants qu’on pourra stimuler l’appétit du consommateur, se substituer à l’import et exploiter le potentiel. 283 projets d’inv e s t"
Le nouveau modèle de développement ne fait pas l’unanimité,2021-06-16,"Alors que quasiment tous les partis politiques n’ont émis aucune critique sur le rendu de la Commission spéciale sur le modèle du développement, des associations se sont fendues de réquisitoires s"
Gazoduc Nigéria-Maroc: Bientôt le lancement des travaux,2021-06-15,"Le Nigéria lancera prochainement la construction du gazoduc qui le reliera au Maroc. C’est ce qu’a annoncé Yusuf Usman, directeur général de la Nigeria National Petroleum Corporation (NNPC) au quo"
"La région de Dakhla, nouvel Eldorado des investisseurs",2021-06-15,"Une convention de partenariat a été signée, vendredi 11 juin 2021 à Dakhla, au siège du Centre régional d’investissement de Dakhla-Oued Eddahab, portant sur la mise en place du programme intégré d"
La charge de la compensation explose à fin mai 2021,2021-06-15,"Selon de nombreux analystes, la surchauffe qui s’est emparée, ces derniers mois, des marchés des matières premières risque de s’intensifier avec les signes avant-coureurs de la reprise économique"
"Le groupe OCP, une signature de qualité",2021-06-14,L’objectif de cette démarche proactive d’OCP est d’optimiser la structure financière du groupe en tirant profit de l’évolution des conditions de marché. OCP S.A. a annoncé avoir procédé avec su
Le Royaume investit dans la réduction des risques,2021-06-14,"La Banque mondiale a renforcé son appui au Maroc en matière de gestion des risques de catastrophe, notamment sous la forme d’aide financière et de conseils techniques. La Banque mondiale (BM) a"
Hausse importante de la production des phosphates au 1er trimestre 2021,2021-06-14,"Alors que plusieurs secteurs économiques s’enfoncent dans la crise à cause de la pandémie, les phosphates et dérivés enregistrent les meilleures performances de production. Des niveaux satisfaisan"
Le pays de l'oncle Sam ouvre ses marchés au Maroc,2021-06-11,"Malgré le ralentissement économique mondial dû à la pandémie, le commerce bilatéral entre les États-Unis et le Maroc en 2020 a atteint 3,3 milliards de dollars. Un volume conséquent qui en dit lon"
LES BANQUES AFRICAINES FACE À LA CRISE,2021-06-11,L’étude dresse un tableau détaillé du secteur bancaire africain face à la crise sanitaire. Quel était le niveau de préparation à la crise des banques africaines? Quelles stratégies ont- elles d
La pandémie creuse les inégalités entre les riches et les pauvres,2021-06-11,"L’économie mondiale va enregistrer cette année sa plus forte croissance en 80 ans mais les pays pauvres, en manque de vaccins contre le Covi-19, continuent d’être à la traîne. L’économie mondia"
"Aziza Ghallam: ""85% des couples infertiles vivent dans la dépression""",2021-06-10,"Pour Aziza Ghallam, présidente de l’Association marocaine des aspirants à la paternité et à la maternité (MAPA), le traitement de l’infertilité n’est pas un luxe mais un droit constitutionnel. Ell"
Appel à une couverture sanitaire totale de l'infertilité,2021-06-10,"Omar Sefrioui, président de la Société marocaine de médecine de reproduction et de médecine foetale. L’Association marocaine des aspirants à la paternité et à la maternité (MAPA) a réitéré son ap"
80% des TPME marocaines touchées par la crise,2021-06-10,"La note d’orientation sur l’impact du Covid-19 sur l’emploi et les TPME au Maroc, élaborée par la Banque africaine de développement (BAD) et l’Organisation internationale du Travail (OIT), préconi"
Comment l’Europe peut reconquérir le Maghreb,2021-06-10,Le think tank français Institut Montaigne recommande aux pays européens de se repositionner au Maghreb en profitant de la crise sanitaire. L’Afrique du Nord a besoin de liquidités et l’Europe doit
Le groupe Crédit Agricole accompagne le déploiement de la stratégie génération Green,2021-06-10,"Un programme qui permettra de réunir, à chaque étape, les jeunes entrepreneurs agricoles afin de les orienter, les encadrer et leur apporter les financements nécessaires favorisant ainsi, l’éclosi"
"1,15 milliard d'Euros de pertes pour l'Espagne",2021-06-09,"Le manque à gagner de la suppression de l’étape espagnole de l’opération Marhaba est évalué à 1,15 milliard d’euros dont 500 millions comme chiffre d’affaires de la traversée du Détroit. Aussi, de"
Appui à l'entreprenariat agricole dans le Gharb et Le Haouz,2021-06-09,Le soutien financier accordé aux projets sélectionnés variera entre 40% pour ceux dont les budgets se situeraient entre 3 et 4 millions de dirhams et 90% pour ceux dont les budgets n’excèderaient
La création d’entreprises souffre de la pandémie,2021-06-09,"Au cours de l’année écoulée, les CRI ont traité 20.467 demandes de création d’entreprises, en baisse de 21% par rapport à l’année 2019, qui avait connu la création de 26.046 entreprises. En dre"
Les provinces du sud au coeur de la dynamique d'investissement,2021-06-09,"L’objectif fixé est, entre autres, d’accompagner 300 porteurs de projets, à l’horizon 2022, et de financer 70% des projets accompagnés. Le Centre régional d’investissement de Laâyoune-Sakia El"
Un Marocain sur 2 a connu au moins une expérience de pauvreté,2021-06-09,"Selon une étude l’Observatoire national du développement humain (ONDH), le taux de pauvreté absolue représente 1,2% des Marocains en 2019, alors que le taux de pauvreté relative se maintient à un"
Attijariwafa Bank initie ses collaborateurs à l'agriculture urbaine,2021-06-08,"À l’occasion de la journée mondiale de l’environnement, célébrée chaque année le 5 juin, Attijariwafa bank a organisé, en collaboration avec l’association Toit En Vert, un «Green Day» sous forme d"
Reprise du trafic aérien au maroc: une bouffée d’oxygène pour la RAM,2021-06-08,"La réouverture des frontières est un soulagement pour la Royal Air Maroc, qui a essuyé de lourdes pertes causées par la fermeture prolongée du ciel marocain. Après l’orage, le décollage. C’est"
Les exportations agroalimentaires ont bondi de 40% sur la période 2014-2020,2021-06-08,"Pour leur deuxième édition, «Les Rendez-vous de l’Industrie» ont choisi pour thème l’agroalimentaire. Organisé le mardi 8 juin 2021 par le ministère de l’Industrie, du Commerce et de l’Economie ve"
Des producteurs Espagnols de fruits et légumes lancent un appel au boycott des produits originaires du Maroc,2021-06-07,"Coexphal, l’association des producteurs de fruits et légumes d’Almeria, déclare la guerre aux produits issus du secteur agroalimentaire marocain. Le conseil d’administration de l’association de"
L'envolée des prix des viandes de volaille persiste,2021-06-07,"Alimentés par la flambée des prix des matières premières agricoles et la hausse du coût du fret, les prix du poulet de chair se sont envolés de 60% sur les quatre premiers mois de l’année. Les"
La CGEM et Mascir joignent leurs efforts pour la promotion de la R&D,2021-06-04,"Les deux institutions mèneront ensemble des actions visant à encourager les entreprises marocaines, tous secteurs et régions confondus, ainsi qu’à inscrire la R&D appliquée dans leurs stratégies d"
"La reprise est là, mais la vigilance reste de mise",2021-06-04,"Tout en annonçant la reprise de la croissance au niveau de l’économie mondiale, les experts de l’OCDE ne manquent pas de mettre en garde contre la persistance de certains vents contraires à cette"
Les big-data au secours du marché du travail,2021-06-04,"Une solution digitale, durable et pérenne d’information, permettant des gains d’efficacité globale du marché du travail. Un accord de coopération vient d’être signé, mardi 25 mai 2021, à Rabat,"
"Nabil Souaf: ""La relance de la plasturgie dépendra de l’application de la préférence nationale""",2021-06-04,"Le secteur marocain de la plasturgie compte 650 entreprises, employant 75.000 personnes et 320.000 en indirect, pour un chiffre d’affaires annuel de plus de 21 milliards de dirhams. Un secteur qui"
Un continent qui table sur la durabilité de son énergie,2021-06-04,Le potentiel de développement de sources d’énergie verte est immense dans la région comme le prouvent les projets d’énergie solaire et éolienne déjà implantés autant dans les zones urbaines que ru
L’Espagne pactise avec le diable,2021-06-03,"Le contrat du gazoduc Maghreb-Europe, qui transite par le Maroc, prendra fin dans cinq mois. Sera-t-il renouvelé ou pas? Une question qui taraude l’Espagne. Le voisin ibérique a dîné avec le diabl"
L'institut CDG se penche sur l'avenir des startups au Maroc,2021-06-02,"Mettre en lumière la réalité de l’écosystème des fintechs au Maroc, tout en offrant un éclairage nouveau sur la profondeur du marché national. Pour le second rendez-vous de son cycle de confére"
Un programme d’accompagnement de 500 porteurs de projets,2021-06-02,"“Inti3ach”. C’est le nom du nouveau programme intégré d’accompagnement et de financement des entreprises (PIAFE) lancé le 31 mai 2021 à Agadir, fruit d’un partenariat signé entre le Centre régiona"
523 projets d’investissement industriels approuvés,2021-06-02,"Les projets d’investissement industriel validés représentant un potentiel de substitution de 35,5 milliards de dirhams d’importation, soit plus que l’objectif initial de 34 milliards prévu à fin 2"
La banque mondiale salue le nouveau modèle de développement du Maroc,2021-06-02,"Selon l‘institution financière internationale les chantiers de réforme déjà engagés au Royaume sont prometteurs, mais les défis sont importants, notamment en matière de mise en oeuvre et de coordi"
Transport ferroviaire et Covid-19 : Légère baisse du chiffre d'affaires de l'ONCF,2021-06-01,"L’Office national des chemins de fer (ONCF) a réalisé un chiffre d’affaires de 813 millions de dirhams au premier trimestre 2021, soit une légère baisse de 8% par rapport à la même période de l’an"
Arrivée de 72 touristes Américains à Fès: Coup de com ou réelle opération de relance du tourisme ?,2021-06-01,"Alors que le tourisme marocain est au bord de la mort suite au maintien des restrictions sanitaires, dont la fermeture des frontières, un avion transportant des touristes de la jet-set américaine"
Rapport d’OBG: La région Souss-Massa s’industrialise,2021-06-01,Le rapport du cabinet de conseil britannique Oxford Business Group revient sur la stratégie de diversification économique de la région Souss-Massa. Une stratégie qui s’est avérée payante en cette
L'OCP plaide pour moins de carbone et plus de solaire,2021-06-01,"En tant qu’entreprise de production d’engrais, l’OCP est déterminé à atteindre zéro émissions nettes de carbone, bien avant 2040. Pour réitérer l’engagement du secteur privé dans l’action clima"
Pour une nouvelle impulsion à l’entreprenariat des jeunes,2021-06-01,"Pour soutenir la reprise, la BAD et l’OIT recommandent d’inclure, dans chaque plan sectoriel de relance, des projets et programmes à fort potentiel d’impact sur la création d’emplois et de réalise"
Hausse des prix des huiles de table: Le Conseil de la concurrence saisi,2021-06-01,"Le consommateur marocain fait face à une flambée des prix des huiles de table depuis février 2021, impactant son pouvoir d’achat. Face au mutisme du gouvernement qui refuse de protéger le consomma"
La Chine dame le pion aux Européens au Maroc,2021-05-31,Le Maroc représente un intérêt majeur pour un géant mondial comme la Chine. Un intérêt qui va crescendo et qui profite d’une sous-estimation caractérisée des pays européens de l’importance de la s
"Lancement à agadir du programme ""Intiach""",2021-05-31,"Plusieurs institutions publiques ont uni leurs efforts au service de la création d’entreprise dans la région d’Agadir. Ainsi, le Centre Régional d’Investissement de la région Souss-Massa, l’Agence"
Plus de 50% des marocains sont surendettés,2021-05-31,Plus de 50% des Marocains sont surendettés. C’est ce que révèle une étude réalisée par la Fédération nationale des associations du consommateur (FNAC) sur phénomène de l’endettemment des consommat
L'industrie de conserve de poisson se renforce,2021-05-31,Quatre unités entièrement spécialisées dans la fabrication de conserves de poisson viennent d’être inaugurées dans la région de Dakhla-Oued Eddahab. L’industrie de transformation du poisson se
Le patron de la douane prône l’accélération de l’exécution des jugements en faveur de l’Etat,2021-05-31,"Le directeur général de l’Administration des Douanes et Impôts Indirects, Nabil Lakhdar, a appelé, mercredi 26 mai 2021, à Benslimane, à la conjugaison des efforts pour l’amélioration du rendement"
Faciliter aux agriculteurs l'accès aux fertilisants,2021-05-28,L’engagement du groupe OCP en faveur “d’une révolution verte en Afrique” se traduit déjà par des résultats tangibles. Moins de 6 ans après la mise en place d’un programme dédié à travers la fil
La fermeture des frontières porte un sérieux coup à l'ONDA,2021-05-28,"Si le gouvernement ne procède pas à la réouverture urgente des frontières aériennes, la situation de l’ONDA et bien d’autres entreprises publiques, comme Royal Air Maroc, va irrémédiablement s’agg"
Les salles de marchés lancent un programme d’accompagnement des PME/TPE,2021-05-28,L’Association marocaine des salles de marchés vient de lancer le programme «Infitah» afin de pousser les PME et les TPE à maîtriser davantage les enjeux de la flexibilisation du dirham et des risq
La BCP scelle un partenariat stratégique avec l'AMEE,2021-05-27,"Une convention de partenariat a été signée, mardi 25 mai 2021, à Rabat, entre l’Agence marocaine de l’efficacité énergétique et le groupe Banque centrale populaire pour la promotion de l’investiss"
Sécuriser l'agriculture contre les aléas climatiques,2021-05-26,"Aménagement hydro-agricole sur 10.000 ha sur l’axe Meski-Boudnib, devant contribuer à la création d’une nouvelle génération de classe moyenne de jeunes entrepreneurs et d’organisations agricoles."
Forbes classe le maroc comme 5ème puissance économique du continent Africain,2021-05-26,"Le Maroc devrait se positionner comme la 5ème puissance économique d’Afrique en 2021 avec un PIB estimé à 124 milliards de dollars, selon un nouveau classement du magazine américain Forbes. Sur le"
Abderrahim Ittas prend en charge la direction exécutive du pôle assurance non-vie des particuliers,2021-05-26,"Une nouvelle nomination a eu lieu à Wafa Assurance. Celleci a, en effet, annoncé, lundi 24 mai 2021, la désignation de Abderrahim Ittas en tant que directeur exécutif en charge du Pôle Assurances"
"Dans le cadre du projet ""Al moutmir"" de l'OCP, le semis direct des céréales double les rendements",2021-05-26,"Les premiers résultats du semis direct des cultures comme les céréales, les légumineuses et les oléagineux sont prometteurs non seulement en termes de rendements, de réduction des coûts de mise en"
Les pistes du CESE pour le renforcement de la classe moyenne,2021-05-26,"Suite à une saisine par le président de la Chambre des conseillers, le CESE a émis une étude sur la classe moyenne où il émet des recommandations à même de renforcer la classe moyenne au Maroc."
"A défaut d’une relance économique, le gouvernement dans l’impasse",2021-05-26,"Le déficit budgétaire atteint des niveaux inquiétants et les recettes de l’Etat se réduisent comme une peau de chagrin. Ne pouvant creuser davantage le niveau d’endettement public, le gouvernement"
Holmarcom rachète une compagnie d'assurance au Kenya,2021-05-25,"Le conglomérat marocain Holmarcom Group, présidé par Mohamed Hassan Bensalah, a acquis, par le biais de sa société holding Holmarcom Insurance Activities, une participation majoritaire dans la soc"
