titre,date,extrait
Le projet de loi de finances 2020: la montagne accouche d'une souris,2020-07-17,"Fidèle à son franc-parler, l’économiste Najib Akesbi a partagé avec nous sa déception par rapport à la loi de Finances rectificative 2020. Scandaleux, insensé, hors contexte…ce projet de loi n’app"
"Il ne suffit pas de déplorer, il faut passer à l’action",2020-07-17,"Le Conseil de la concurrence appelle à mettre fin aux positions dominantes de tous les opérateurs historiques qui jouissent des infrastructures de l’Etat, ainsi qu’aux situations oligopolistiques"
"Le Maroc, un gardien ""géopolitique"" du corridor Europe-Afrique",2020-07-17,"Si le Maroc se trouve aujourd’hui au centre de plusieurs convoitises, c’est grâce particulièrement à ses stratégies visionnaires axées sur le développement d’infrastructures de premier plan. Plaqu"
Comment l'industrie marocaine a fait face au Covid-19,2020-07-17,"Le dernier rapport d’Oxford Business Group, en collaboration avec l’Agence marocaine de développement des investissements et des exportations, souligne la mobilisation de l’industrie marocaine fac"
La transformation de la CCG en SA sur les rails,2020-07-17,Le projet de transformation de la Caisse centrale de garantie (CCG) en société anonyme va bon train. La Chambre des représentants vient d’adopter le projet de loi 36.20 relatif à la transformation
Attijariwafa Bank Europe propose en France une large gamme de prêts à la consommation,2020-07-17,Attijariwafa bank Europe est mobilisée depuis le début de la crise sanitaire pour aider ses clients en France dans la réalisation de leurs projets. Attijariwafa bank Europe propose à ses client
"Proximité : Société Générale lance SOGÉ, une solution bancaire digitale",2020-07-17,"Le groupe bancaire, Société générale renforce sa stratégie digitale par le lancement de la solution numérique, SoGé. Une solution qui se décline comme une banque en ligne avec plusieurs promesses"
Mobile Money : les clients Orange peuvent désormais alimenter leur compte sans se déplacer,2020-07-17,"Orange Money offre désormais la possibilité à ses clients d’alimenter leurs comptes Orange Money directement sur l’application mobile via carte bancaire, sans avoir à se déplacer en agence. Une fo"
La réforme du secteur public n’est pas une priorité,2020-07-16,"Est-ce que ça urge à ce point? N’a-t-on rien à faire avec cet argent, emprunté avec des intérêts de surcroît, pour le dépenser à bon escient? Ou bien c’est la même Banque mondiale, qui nous impose"
BANK TAMWIL WAL INMAE LANCE SA BANQUE À DISTANCE,2020-07-16,"La première offre, BTI connect, est destinée aux particuliers, et la deuxième, BTI Business Connect, aux entreprises et aux personnes morales. Bank Tamwil wal Inmae (BTI Bank) vient de mettre s"
Automobile: PSA doublera la capacité de l'usine de kénitra à partir de septembre,2020-07-16,"Malgré la crise liée au Covid-19, le groupe PSA poursuit ses engagements et investissements au Maroc, en doublant la capacité de l’usine de Kénitra à 200.000 véhicules à partir de septembre 2020."
Le retrait d'agrément de global nexus validé par Benchaâboun,2020-07-16,"Nouveau rebondissement dans l’affaire Global Nexus. L’Autorité marocaine du marché des capitaux (AMMC) a annoncé le retrait d’agrément de la société de gestion par arrêté de Mohamed Benchaâboun, m"
Le département de Benchaâboun se réorganise,2020-07-16,"Le conseil du gouvernement qui se réunit ce jeudi 16 juillet 2020 aura à examiner le projet de décret 2.20.394 qui fixe les prérogatives et l’organisation du ministère de l’Economie, des Finances"
Efficacité énergétique : la SIE devient super ESCO et change de dénomination,2020-07-16,"La Société d’Investissements Energétiques a dévoilé, le 14 juillet lors de son conseil d’administration, son identité de Super Esco en adoptant la nouvelle dénomination de Société d’Ingénierie Ene"
Ménara Holding certifie son système de management du risque sanitaire,2020-07-16,"Ménara Holding a certifié son système de management du risque sanitaire de ses deux filiales Ménara Préfa et Carrières & Transport Ménara. Obtenues par l’organisme indépendant Socotec, ces certifi"
12 MM dhs de chiffre d'affaires attendu à l'Aid Al Adha,2020-07-15,"L’Aïd Al Adha pourrait rapporter un chiffre d’affaires de plus de 12 milliards de dirhams cette année, selon le ministère de l’Agriculture, de la Pêche maritime, du Développement rural et des Eaux"
L'état débloque 7 milliards de dirhams pour la RAM et l'ONEE,2020-07-15,"Malgré les difficultés économiques qu’elle a connues tout au long de la période du confinement, la compagnie aérienne nationale, Royal Air Maroc, commence progressivement à sortir la tête de l’eau"
Immobilier: YAMED Promotion livre la première tranche de terre océane,2020-07-15,"Yamed Promotion, marque immobilière de Yamed Capital spécialisée dans le résidentiel de haut standing, a livré en juillet 2020 la première tranche des villas Terre Océane «conformément au planning"
LES MESURES DU PLFR SONT INSUFFISANTES,2020-07-14,"Si le projet de loi de Finances rectificative donne la priorité aux entreprises nationales dans les marchés publics, il n’apporte pas de réelles garanties à cet accès, en particulier pour les TPME"
Intelcia adopte un nouveau modèle de sites et vise 800 emplois à Oujda,2020-07-13,Le groupe Intelcia lance un nouveau modèle de sites combinant télétravail (4 jours sur 5) et présentiel. Un mode qui permettra au spécialiste de la relation client de s’implanter dans des régions
Une contribution de 3 milliards de dirhams au budget général de l'état,2020-07-13,"Un conseil d’administration exceptionnel de l’Agence Nationale de la Conservation Foncière a été tenu le vendredi 10 juillet 2020 par visioconférence. Présidé par le ministre de l’Agriculture, de"
L'investissement étranger atteint 200 milliards de dh en actions cotées en 2019,2020-07-13,"200 milliards de dirhams. C’est le montant global de l’investissement étranger en actions cotées en 2019, selon le rapport sur l’investissement étranger en instruments financiers de l’Autorité mar"
Deux nouvelles nominations chez Société Générale Maroc,2020-07-13,Nouvelles nominations chez Société Générale Maroc. Le groupe bancaire a nommé Mehdi Benbachir DGA en charge de la Business Unit Retail membre du Comex; et Larbi Mouline membre du Comex en charge d
Wafa Assurance : nomination de Koudama Zeroual à la tête du pôle non-vie des particuliers,2020-07-13,"Selon un communiqué de Wafa Assurance, Koudama Zeroual vient d’être nommé directeur exécutif en charge du Pôle Assurances Non-Vie des Particuliers. Le pôle en question comprend les directions de l"
L’EMPLOI EN ACTION,2020-07-13,"Le but de l’ANAPEC n’est autre que d’assurer une mission de service public universel d’emploi, au service de tout citoyen marocain. Au moment où le ministre du Travail et de l’insertion profess"
Le Maroc compte s'installer dans la croissance verte,2020-07-13,"Lors d’une rencontre virtuelle, jeudi 9 juillet 2020, le Conseil économique, social et environnemental (CESE) a appelé à mettre en place une nouvelle stratégie dont les fondamentaux permettraient"
Tout pour satisfaire le client,2020-07-13,"En certifiant ses activités Mobile Banking, Barid Bank confirme sa ferme volonté de digitaliser sa relation avec ses clients. Al Barid Bank a obtenu en juin dernier une double consécration à tr"
MANAGEM DÉCROCHE UN CONTRAT DE PRÈS DE 100 MILLIONS D’EUROS AUPRÈS DE BMW,2020-07-09,Managem a signé avec BMW un contrat (2020-2025) pour l’approvisionnement d’un cinquième des besoins en cobalt pour la conception de la 5e génération de véhicules électriques du constructeur allema
Fonds dédié à la gestion du covid-19: plus que 8 milliards dans les caisses !,2020-07-09,Il ne reste pas beaucoup d’argent dans le Fonds dédié à la gestion du Covid-19 dont la raison d’être restera valable jusqu’à fin 2020. Les conséquences socio-économiques de la pandémie étant toujo
"LES IMMEUBLES DE BUREAU, UN INVESTISSEMENT PORTEUR",2020-07-09,"Devant s’inscrire dans le long terme, l’investissement dans un OPCI offre un avantage par rapport à l’achat d’un bien immeuble. L’Autorité marocaine du marché des capitaux (AMMC) a délivré, ven"
La trésorerie générale du royaume publie ses statistiques sur les recettes publiques,2020-07-08,"L’orientation des recettes fiscales, principales composantes des ressources de l’Etat, s’avère défavorable, ce qui met à mal le budget de l’État pour financer les programmes sociaux et limiter le"
Le Maroc veut séduire les investisseurs Allemands,2020-07-08,"En ces périodes difficiles de crise économiques, les entreprises internationales, notamment allemandes, peuvent considérer le Maroc comme un véritable relais de croissance pour leurs investissemen"
Bank Al-Maghrib: les banques solides et résilientes face au COVID-19,2020-07-07,"Bank Al-Maghrib semble confiante quant à la solidité du secteur bancaire marocain, malgré la crise liée au Covid-19. Toutefois, le risque de concentration sur les grands débiteurs auquel sont expo"
Relance du tourisme en afrique: réajustement du programme d'action,2020-07-07,"L’Organisation mondiale du tourisme est déterminée à faire que le tourisme africain émerge de cette crise comme un important pilier de l’économie, de l’emploi et de la durabilité. L’Organisatio"
Immobilier: trafic record pour sarouty.ma en juin,2020-07-07,"Bon cru en juin pour Sarouty. ma. Les recherches effectuées sur le site, spécialisé dans les annonces immobilières, ont augmenté de 30% par rapport à un mois auparavant. Le portail enregistre actu"
Sauvetage de la RAM: plus de 858 licenciements prévus,2020-07-06,"Abdelhamid Addou a fait part de sa décision d’activer un plan social au sein de la compagnie aérienne nationale. Mais est-ce vraiment le moment de reculer? Il est donc là, le plan de sauvetage"
LE MAROC OFFICIELLEMENT EN RÉCESSION,2020-07-06,"Avec 13,8% de recul de son PIB au deuxième trimestre, le Royaume a tout à craindre pour son économie. Alors qu’il avait mis en évidence, dans une note de conjoncture qu’il avait publiée le 30 j"
VERS UN NOUVEAU MODÈLE ORGANISATIONNEL,2020-07-06,Il n’y a pas de changement majeur au niveau des noms figurant dans l’organigramme mais une redéfinition des périmètres du Groupe. Le groupe BCP déploie dès le lundi 6 juillet 2020 sa nouvelle o
EQDOM ENTAME SON VIRAGE DIGITAL ET CHANGE D’IDENTITÉ VISUELLE,2020-07-06,"Nouvelle identité visuelle pour Eqdom. Le spécialiste du crédit à la consommation a adopté un nouveau logo autour de trois couleurs (rouge, noir et blanc), ainsi qu’une nouvelle signature: «L’esse"
Tourisme : les recettes voyages au rendez-vous,2020-07-06,"Les recettes voyages ont atteint en 2019 un record de 78,8 milliards de dirhams (MMDH). Après celui enregistré une année auparavant à 73 MMDH, selon un rapport de l’Office des changes. Avec ses"
UNE VOIE QUI NOUS SOIT PROPRE,2020-07-06,"Partant d’une approche collaborative et territoriale, la réflexion d’Al Mountada n’a d’autre but que de produire et de diffuser des idées, des analyses et des propositions alternatives. Partant"
LA RELANCE PAR LA DETTE?,2020-07-03,Sauvetage donc des entreprises en mesure de réunir des conditions et leur accompagnement dans la durée: voilà sans doute les deux crédos qui s’imposent. L’on commence aujourd’hui à avoir un peu
Le GCAM au rendez-vous,2020-07-03,"Alors que l’économie nationale traverse actuellement un moment on ne peut plus difficile pour cause de la pandémie de Covid-19, le groupe Crédit agricole du Maroc a su particulièrement tenir son r"
"Entretien avec Karim Cheikh, Président du Groupement des industries marocaines aéronautiques et spatiales (GIMAS)",2020-07-03,"Le secteur aéronautique marocain est touché de plein fouet par la crise liée au Covid-19. La baisse d’activité, cette année, avoisinera 50%, selon Karim Cheikh. Dans cet entretien, le président du"
L’aéronautique traverse avec résilience une zone de turbulences,2020-07-03,"L’onde de choc des plans sociaux et des faillites des constructeurs aéronautiques internationaux a résonné chez les équipementiers marocains. Toutefois, cet impact n’a pas été dévastateur pour le"
Conférence digitale de la fondation Attijariwafa Bank autour Covid-19,2020-07-03,"La Fondation démontre, une fois de plus, sa volonté de favoriser la proximité avec l’ensemble des citoyens, tout en soutenant un débat constructif autour de thématiques d’actualité. Dans le cad"
"L'automobile, dernier souci du consommateur",2020-07-03,"Le secteur de l’automobile continue d’être sérieusement impacté par la crise sanitaire due au coronavirus. La baisse enregistrée au cours des mois de mars, avril et mai devrait se poursuivre au mo"
L’OFFICE DES CHANGES TIRE LA SONNETTE D’ALARME,2020-07-02,"Si les derniers indicateurs des échanges extérieurs de l’Office des changes confirment une chose, c’est que la pandémie de Covid-19 est en train de sévèrement grever l’économie nationale. Les p"
DES PERSPECTIVES DE SORTIE DE CRISE INCERTAINES,2020-07-02,"Chantiers à l’arrêt, transactions quasiment mises en veilleuse, main-d’oeuvre au chômage technique et demande inexistante… Le secteur de l’immobilier au Maroc fait face à des difficultés diverses."
DERNIÈRES STATISTIQUES MONÉTAIRES DE BANK AL MAGHRIB,2020-07-02,"Fin mai 2020, la circulation fiduciaire a atteint 289,6 milliards de dirhams, selon les dernières statistiques monétaires de Bank Al-Maghrib. Un montant en hausse de 15,7% depuis le début de l’ann"
ROYAL AIR MAROC RENFORCE SES VOLS DOMESTIQUES À PARTIR DU 6 JUILLET,2020-07-02,"Une bouffée d’oxygène pour Royal Air Maroc. La compagnie nationale vient d’augmenter et de rétablir ses liaisons avec Casablanca et ses fréquences de vols domestiques. A partir du 6 juillet, le no"
"À peine 0,1% de croissance au premier trimestre",2020-07-01,"Dans une note d’information qu’elle vient de publier ce 30 juin, l’institution dirigée par Ahmed Lahlimi Alami révèle une hausse d’à peine 0,1% de la croissance, ce qui est pire que ses propres pr"
Les artisans auront leur couverture sociale,2020-07-01,"Le secteur de l’artisanat emploie près de 2,4 millions d’artisans, soit 20% de la population active, et contribue à hauteur de 7% au PIB national. Le projet de loi 50-17 portant sur l’organisat"
L'ONEE lancera sa salle des marchés en 2021,2020-07-01,"L’Office national de l’électricité et de l’eau portable (ONEE) lance un dispositif de modernisation de ses processus d’achat, impliquant la mise en place d’une salle des marchés en 2021. L’objecti"
Un après confinement sous le signe de l'optimisme,2020-07-01,"Si les entreprises marocaines ont fortement souffert du blocage de l’économie lié à la pandémie du Covid-19 et ne voient pas encore le bout du tunnel, l’assouplissement progressif du confinement l"
La DGI se mobilise en faveur du contribuable,2020-07-01,"Le 19 mars 2020, le Comité de veille économique (CVE), après s’être penché sur les répercussions de la pandémie du coronavirus et ses effets sur les PME, avait adopté une mesure qui permet aux ent"
MyMaroc : la plateforme qui promeut le tourisme au Maroc,2020-07-01,"Initiée par des professionnels des médias et du monde du tourisme, MyMaroc révèle une nouvelle histoire qui commence avec des passionnés du tourisme qui veulent voir le secteur du tourisme au Maro"
"Interview de Ismael Belkhayat, PDG de chari.ma",2020-06-30,"Avec chari.ma, Ismael Belkhayat veut permettre aux épiciers marocains d’automatiser leur processus d’approvisionnement et de le faire en moins de 24h chrono. Après l’immobilier avec sarouty.ma,"
"""Salama au travail"", une initiative du FNUAP",2020-06-30,"L’initiative accorde une attention particulière aux femmes qui viennent des communautés les plus exclues, qui ont le plus subi les effets d’une crise tout à la fois sanitaire qu’économique. Le"
Le référentiel de prévention s’impose,2020-06-30,L’ensemble des professionnels de l’industrie agro-alimentaire disposant d’unités de la chaîne de froid sont invités à intégrer le contenu du référentiel des mesures préventives dans le protocole d
L'Espagne maintient son rang au Maroc,2020-06-30,"Avec une part d’échange de 65,8%, l’Europe renforce sa position de premier partenaire commercial du Maroc en 2019, rapporte l’Office des changes. L’Espagne est d’ailleurs toujours en tête avec 28,"
Petrom lance le paiement mobile en partenariat avec CIH Bank,2020-06-30,"Petrom vient d’annoncer, le 26 juin 2020, le lancement du paiement mobile en partenariat avec CIH Bank. Ce service sera déployé progressivement sur l’ensemble de son réseau, comptant plus de 280 s"
L'université du Crédit du Maroc se mobilise pour soutenir les collaborateurs de la banque,2020-06-30,"L’Université Crédit du Maroc a lancé un programme de digital learning, depuis le 22 avril 2020, destiné aux collaborateurs et ayant pour objectif l’accompagnement, le soutien et l’assistance des é"
Nos jeunes émigrés en mal d'égalité des chances,2020-06-29,"En ce qui concerne les jeunes Marocains ayant du mal à trouver du travail, l’accès à de nouvelles responsabilités et le relationnel client sont les difficultés les plus remontées par l’enquête."
Relance : 750 millions de dirhams par an pour aider les TPME industrielles,2020-06-29,"Avec Tatwir et Nawat, le ministère de l’Industrie souhaite permettre aux TPME industrielles marocaines de dépasser la crise actuelle provoquée par la pandémie de Covid-19. Et vise même plus loin."
Le lobby des pétroliers accusé de pratiques anticoncurrentielles,2020-06-29,"Le 21 juillet est le jour prévu par le Conseil de la concurrence pour prononcer des sanctions pécuniaires importantes contre les opérateurs pétroliers accusés, entre autres, de pratiques anticoncu"
BENCHAÂBOUN VA-T-IL SECOUER LE COCOTIER ?,2020-06-26,"Alors que le gouvernement avait promis de renforcer l’investissement public pour financer le redémarrage post-confinement, ce dernier tarde à venir. Au risque d’installer une poudrière dont le Mar"
"Interview de Abdellah El Fergui : ""Le gouvernement n'a pas de plan de relance""",2020-06-26,"Pour la Confédération marocaine des TPE/ PME, le gouvernement Saâd Eddine El Othmani ne fait que favoriser les grandes entreprises dans son plan de relance post-Covid-19, sans vraiment prendre en"
Les banques en première ligne,2020-06-26,Les banques sont invitées à s’investir davantage pour la réussite de la relance économique et pour contribuer à redonner de la visibilité aux opérateurs économiques. L’heure est grave. On ne ba
Modernisation de la vente du bétail au Maroc,2020-06-26,Ce nouveau concept introduit par la Comader répond aux mesures sanitaires et se caractérise par des installations qui permettent une évolution des souks de bétail hebdomadaires vers des marchés à
Des participants high tech,2020-06-26,"Dotés d’excellentes qualités, les participants primés ont réalisé des projets pertinents et novateurs. Fortement imprégnés des nouvelles technologies, les étudiants ont fait preuve d’une grande"
UN APPUI DES PLUS OPPORTUNS,2020-06-26,"Lors d’une e-rencontre avec le directeur du département Maghreb, Jesko Hentschel, tenue le mardi 23 juin 2020, la Banque mondiale a fait le point sur son appui au Maroc, depuis l’avènement de la p"
L'ONEE porté à la présidence de la global sustainable electricity partnership,2020-06-26,Une occasion offerte pour partager avec les grandes entreprises d’électricité au monde les spécificités des problématiques énergétiques en Afrique et les défis à relever pour généraliser l’accès à
Relance : Plus de 23 milliards de dirhams d'investissements validés par le gouvernement,2020-06-25,"Malgré le Covid-19, le Maroc s’en sort pour le moment en termes d’investissements. Mais il ne faudra, pour autant, pas se reposer sur ses lauriers. En dépit de la morosité ambiante et qui, au c"
DE LOURDES INCERTITUDES AUTOUR DE LA CONJONCTURE,2020-06-25,"Pâtissant des implications néfastes de la pandémie du Covid-19, l’économie marocaine connaîtrait une forte récession en 2020, et ce, malgré les perspectives de reprise de l’activité économique qui"
"Interview de Yassmina El Farissi, présidente de la Confédération nationale des TPE/PME",2020-06-24,"Avec Business B’darija, Yassmina El Farissi souhaite proposer un accompagnement aux entrepreneurs nationaux non-francophones et leur permettre d’être eux aussi mis au fait des informations nécessa"
Quand le patronat défend ses priorités,2020-06-24,Le secteur privé a plus que jamais besoin de visibilité à moyen terme pour faire face à la récession de l’économie et son corollaire la vague de licenciements massifs. “Une politique nationale
MOODY'S ALERTE SUR LA DETTE PUBLIQUE,2020-06-24,"L’augmentation de la dette est plus importante, plus soudaine et plus généralisée que pendant la crise financière mondiale, reflétant la nature aiguë et mondiale du choc du coronavirus. Rares s"
LES ENTREPRISES PUBLIQUES SOUS LE CHOC,2020-06-23,"Les entreprises et établissements publics ont adressé à l’Etat des demandes de soutien financier dépassant 16 milliards de dirhams, dont 10 milliards de dirhams à caractère urgent et ce, dès 2020."
"""LES ENTREPRISES AURONT LEUR MOT À DIRE DANS LA RELANCE""",2020-06-23,"Avec Demary, plateforme mobilisant une centaine de mentors et d’experts en faveur des TPE pour surmonter la crise due au Covid-19, la société Mentor souhaite apporter sa pierre au redressement éco"
POURQUOI A-T-ON TUÉ L’OCE ?,2020-06-23,"L’Office de commercialisation et d’exportation (OCE) est jeté à la poubelle de l’histoire. L’Etat use, une nouvelle fois, du facteur temps pour faire oublier un des grands dossiers de malversation"
DES ENTREPRISES EN MAL DE VISIBILITÉ,2020-06-22,86% des jeunes lauréats ont témoigné d’une suspension ou d’un report de leur recrutement à cause de la pandémie du Coronavirus Face à l’hémorragie provoquée par l’arrêt des activités ainsi que
CRISE : MISER SUR LE TOURISME INTERNE,2020-06-22,"Les Marocains seront peut-être plus nombreux cet été à vouloir jouer les touristes dans leur propre pays. Mais seuls des prix attractifs des hôtels, classés et non classés, ainsi que de lieux d’hé"
LA RAM VA RESPIRER UN PEU,2020-06-22,La décision du gouvernement d’autoriser les vols domestiques peut être un premier pas pour résorber le choc provoqué par la pandémie de Covid-19 sur la compagnie aérienne nationale. Un bol d’ai
L’ÉCLOSION DE NOUVEAUX MOYENS DE PAIEMENT,2020-06-22,"Une alternative à l’usage du paiement en espèce, garantissant instantanéité et sécurité. Dans un contexte de crise sanitaire, de nouvelles tendances de consommation se confirment. L’usage du di"
Kamal Mokdad remplace Hamid Tawfiki à la tête du Conseil d’administration de la Bourse de Casablanca,2020-06-22,"“Le Conseil d’administration de la Bourse de Casablanca s’est réuni, le 18 juin 2020, en vue de désigner le successeur de Hamid Tawfiki, président du Conseil d’administration de la Bourse de Casab"
Le plan de Bank Al Yousr pour accompagner ses clients,2020-06-22,"Bank Al Yousr, la banque participative du groupe BCP, se mobilise aux côtés de ses clients-entreprises pour favoriser la reprise de leur activité économique, à travers les produits Salam, Mourabah"
Quand la sécurité sanitaire des aliments fait défaut,2020-06-19,"Une proportion très appréciable des entreprises agroalimentaires ne disposent pas de plan de maîtrise sanitaire. Le Conseil économique, social et environnemental (CESE) a organisé, mercredi 17"
LES PISTES ÉCONOMIQUES SONT-ELLES SUFFISANTES?,2020-06-19,"Depuis le recouvrement de son indépendance, le Maroc a traversé trois principales étapes dans sa quête de développement socio-économique. Durant la première étape (années 1960 et 1970), le mode de dév"
La cession de la Samir est-elle encore possible?,2020-06-19,"Le syndic judiciaire désigné par le tribunal n’a pas réussi, depuis 2016, à trouver un repreneur. Plusieurs offres internationales de reprise ont été exprimées. Mais aucune n’a abouti. Le dossi"
Le Crédit Agricole prend des mesures fortes,2020-06-19,"La banque verte a mis en place un dispositif spécifique pour apporter l’appui nécessaire à l’ensemble des agriculteurs sinistrés, clients et non-clients C’est la mobilisation générale en faveur"
L'Etat prend des risques,2020-06-19,"Pour la première fois, l’Etat prend tous les risques pour éviter une crise cardiaque à l’économie. A travers le wali de Bank Al Maghrib, il fait sauter tous les verrous pour libérer ainsi le crédi"
Visas Schengen : vers une réouverture progressive,2020-06-19,"Les demandes de visas seront ouvertes à partir du 22 juin au consulat Général de France à Rabat. Sont strictement concernés: les étudiants, les travailleurs et les candidats au regroupement famili"
"""Le Maroc peut être une référence au niveau de l'Afrique""",2020-06-18,"Alors que les appels en faveur de la consommation du made in Maroc se multiplient en ces temps de Covid-19, l’APMM voit là l’aboutissement d’un travail mené par elle depuis six ans A la tête de"
