titre,date,extrait
"Le Maroc, un hub vers l'Afrique pour les entreprises espagnoles",2017-10-03,"Le Maroc représente un hub vers l'Afrique pour les entreprises espagnoles, a affirmé, mardi à Rabat, la Secrétaire d’Etat espagnole au Commerce, María Luisa Poncela García, pour qui l’Espagne et le"
Boussaid présente les grandes lignes du projet de loi portant statut de Bank Al-Maghrib,2017-09-29,"Mohamed Boussaïd Les grandes lignes du projet de loi n 40-17 portant statut de Bank Al-Maghrib, qui s'inscrit dans la continuité des réformes structurelles visant à renforcer et moderniser le systèm"
Automobile: Le taux d'intégration locale se situe actuellement à 50%,2017-09-29,"Le taux d’intégration locale en industrie automobile au Maroc se situe actuellement à 50% et atteindra 80% à l'horizon 2020, a indiqué, jeudi à Casablanca, le ministre de l’Industrie, du commerce et"
Plus de 620 mille personnes interdites d'émettre des chèques en 2016,2017-09-28,"Le nombre d'interdits d’émission de chèques s'est élevé à 621.990 personnes en 2016, en hausse de 3,89% par rapport à un an auparavant, fait savoir Bank Al-Maghrib (BAM), qui fait état d'une prédomi"
LafargeHolcim Maroc intègre sa nouvelle stratégie RSE dans sa performance globale,2017-09-27,"© ph:DR Des actions durables au profit des populations Depuis l’annonce de la fusion, LafargeHolcim Maroc a une nouvelle stratégie RSE. Ses premiers résultats témoignent d’un engagement fort et durab"
Réforme du taux de change: BAM disposé à mener d'éventuelles études complémentaires,2017-09-27,"Abdellatif Jouahri, gouverneur de Bank Al Maghrib. Bank Al-Maghrib est disposé à mener les études complémentaires et les simulations nécessaires pour mieux accompagner la réforme du taux de change,"
Automobile: le groupe italien Magneti Marelli s'implante à Tanger,2017-09-26,"Le Maroc et le groupe italien Magneti Marelli ont conclu, mardi à Rabat, un accord portant sur l'implantation à Tanger d’une usine spécialisée dans la production de composants automobiles pour un in"
"Lancement à Casablanca du guichet ""Taechir CFCA"" pour faciliter le recrutement des expatriés",2017-09-25,"Le guichet ""Taechir"", destiné à faciliter le recrutement des expatriés au profit des entreprises labellisées CFC, a été lancé, lundi, par le ministre du Travail et de l'insertion professionnelle, Mo"
La finance participative décortiquée par des experts,2017-09-25,"Youssef Baghdadi,Président du Directoirede Bank Assafa. La finance islamique vulgarisée Bes experts de Bank Assafa, en partenariat avec le cabinet Al Maali, ont entamé, jeudi 14 septembre 2017 à Casa"
Une croissance loin de son potentiel,2017-09-20,"Bank Al Maghrib analyse l’économie marocaine sur la période 1991- 2016 Omar Chafik, un chercheur de Bank Al Maghrib, que dirige Abdellatif Jouahri, s’est livré à une comparaison entre la croissance e"
"Interview de Larbi Lahlou, directeur général adjoint de MAMDA MCMA",2017-09-20,"LARBI LAHLOU, directeur général adjoint de MAMDA MCMA Pensez-vous que le modèle marocain d’assurance agricole peut s’exporter en Afrique? Je peux vous dire que le développement de l’assurance agrico"
Le marché de l'immobilier peine à redémarrer,2017-09-20,"© ph : DR A Casablanca, les biens immobiliers se vendent mal malgré une demande pressante Dans la capitale économique, face à une reprise de la demande sur le résidentiel et le foncier, une offre ina"
"Le Maroc, tête de pont de nombres d'investissements internationaux en Afrique",2017-09-20,"Le Maroc, qui est le second pays en termes d’IDE en Afrique, apparaît aujourd’hui comme une tête de pont de nombres d’investissements internationaux sur le continent, souligne un rapport rendu publi"
Les prévisions du gouvernement tablent sur une hausse de la croissance,2017-09-19,Une situation économique inquiétante Le manque de visibilité est devenu le leitmotiv des opérateurs économiques. Et les coupures successives dans les budgets d’investissements publics et des secteurs
Energie: Le Maroc investira 40 milliards de dollars à l'horizon 2030,2017-09-18,"Le Maroc s'est engagé à investir 40 milliards de dollars à l'horizon 2030 pour développer le secteur énergétique, a fait savoir, dimanche à Manama, le ministre de l'énergie, des mines et du Développ"
Nouveau contrat d'exploitation du tramway et de bus à Casablanca,2017-09-18,"Le directeur général de Casa Transports, Youssef Draiss, et la présidente du directoire de RATP Dev, Laurence Batlle, ont procédé, vendredi, à la signature du nouveau contrat d'exploitation et de ma"
"Les certifications ""Halal"" et ""Bio"" pour protéger le patrimoine culinaire marocain",2017-09-15,"L’organisateur du salon Expo Halal International ou Mahal Expo, Mohamed El Ouahdoudi, a appelé jeudi, à Marrakech, à adopter des certifications ""Halal"" et ""Bio"" pour protéger le patrimoine culinaire"
M. Akhannouch s'entretient avec le Vice-ministre russe de l’Agriculture,2017-09-14,"Le ministre de l’Agriculture, de la Pêche maritime, du Développement Rural et des Eaux et Forêts, M. Aziz Akhannouch s’est entretenu, jeudi à Saint-Pétersbourg, avec le Vice-ministre de l’Agricultur"
Jouahri classé parmi les meilleurs gouverneurs des banques centrales du monde,2017-09-09,"Abdellatif Jouahri, gouverneur de Bank Al Maghrib. Le Wali de Bank Al Maghrib, Abdellatif Jouahri, figure parmi les meilleurs gouverneurs des banques centrales dans le monde, selon le ""Central Banke"
Le groupe français Engie se délocalise au Maroc,2017-08-20,Une éclaircie pour le marché de l'emploi Environ 800 postes devraient être créés au Maroc entre Casablanca et Rabat. 600 concernent des fonctions dans des centres d’appel pour particuliers et 200 pou
Bank Assafa démarre officiellement son activité en diffusant son film institutionnel,2017-08-18,"Youssef Baghdadi ratisse large dans sa communication institutionnelle Chose promise, chose due. Youssef Baghdadi, président du directoire de la banque participative Bank Assafa, a lancé sa campagne d"
"Othman Benjelloun: ""Le projet Tanger Tech est sur la bonne voie""",2017-07-28,"La mise en œuvre du projet de création de la ville industrielle "" Cité Mohammed VI Tanger Tech "" est sur la bonne voie, a affirmé, jeudi à Casablanca, le président du groupe BMCE Bank Of Africa, M."
Un financement de 6 MMDH accordé annuellement aux associations,2017-07-26,"Le montant global du financement public accordé annuellement par les départements ministériels, les établissements et les entreprises publics au profit des associations est estimé à 6,423 MMDH, a so"
"En marge du sommet du G20, Miriem Bensalah s'engage pour l'entrepreneuriat féminin",2017-07-19,"Faire confiance aux femmes La patronne des patrons du Maroc a plaidé, lors du sommet des pays les plus riches de la planète en Allemagne, pour la nécessite de faciliter l’accès des femmes entrepreneu"
"Interview de Khalid Cheddadi: ""Tous les Marocains sont éligibles à notre système de retraite""",2017-07-19,"KHALID CHEDDADI, PDG de la Société mutuelle de retraite Après voir changé, il y a six mois, son statut réglementaire, la Société mutuelle de retraite (SMR), ancienne CIMR, aborde l’avenir avec de no"
CDG Développement cède ses actions dans la société Med Paper au profit d'Anas Sefrioui,2017-07-19,"La première facture d’une orientation stratégique Le retrait de CDG Développement du tour de table de la société Med Paper, au profit de la société Aliken fait dégager des pertes. S’agit-il là de la"
Crédit Agricole du Maroc dévoile son dispositif financier pour la valorisation de l'industrie agroalimentaire,2017-07-19,"Tariq Sijilmassi, président du Crédit Agricole du Maroc Une offre exhaustive et adaptée à tous les besoins Trois mois après la signature du contrat-programme de l’industrie agro-alimentaire, le group"
"Le groupe OCP dénonce une ""grave ingérence politique""",2017-07-13,"En décidant de renvoyer l'affaire du navire « Cherry Blossom » au fond, la cour sud-africaine rend une décision éminemment politique et commet un grave abus de pouvoir, estime le Groupe OCP dans un"
Le groupe BCP devient le 1er groupe bancaire du Niger suite à l'acquisition de  la banque BIA,2017-07-12,"Le groupe BCP renforce davantage son maillage africain en finalisant cette fois l'acquisition de la prise de contrôle de la Banque Internationale pour l'Afrique au Niger (BIA-Niger), deuxième instit"
Les banques participatives entreront en service dans les prochaines semaines,2017-07-12,"Les banques participatives entreront en service dans les prochaines semaines, après le parachèvement de toutes les dispositions légales et techniques et l'agrément par Bank Al Maghreb des établissem"
Les textiliens marocains en mission de prospection dans le nord du Portugal,2017-07-11,Une délégation de l’Association marocaine des industries du textile et de l’habillement (AMITH) a effectué récemment une mission de prospection et de networking avec les acteurs majeurs de l’amont t
"Le taux de croissance au Maroc pourrait atteindre 4,8% en 2017, selon le FMI",2017-07-11,"Le taux de croissance économique au Maroc devrait rebondir à 4,8% en 2017, grâce à une reprise ""vigoureuse"" dans le secteur agricole, a estimé lundi à Rabat, le chef de la mission de consultation du"
La présidente de la CGEM au G20 pour parler de l’entrepreneuriat féminin,2017-07-07,"Miriem Bensalah Chaqroun. Mme Miriem Bensalah Chaqroun, Présidente de la CGEM, prend part au panel commémoratif du lancement officiel de l’initiative Women Entrepreneurs Finance (We-Fi), qui se tien"
Un prêt de 25 millions de dollars pour un projet d'énergie solaire,2017-07-05,"Le Maroc vient d'obtenir le feu vert pour un prêt de 25 millions de dollars du Fonds pour les Technologies Propres, dans le cadre des Fonds d'investissement climatique, pour un projet visant à génér"
Le poids économique des pays du CCG dans l'économie marocaine augmente,2017-06-30,Plus du quart des flux des IDE entrants au Maroc Le tarissement de la demande européenne et la volonté du Maroc de diversifier ses échanges pour casser le poids de l’Europe a augmenté le poids des pa
Al Hoceima: Akhannouch appelle à accélérer les travaux de réalisation d'une unité d'usinage de lait à Imzouren,2017-06-30,"Aziz Akhannouch Le ministre de l'Agriculture Aziz Akhannouch a appelé les responsables en charge du projet de construction d'une unité d’usinage de lait à Imzouren, province d’Al-Hoceima à accélérer"
233 tonnes de produits impropres à la consommation durant le mois de ramadan,2017-06-29,Quelque 233 tonnes de produits impropres à la consommation ont été saisies et détruites durant le mois sacré de Ramadan par les services de contrôle de l'Office National de Sécurité Sanitaire des Pr
Le gouvernement continuera à subventionner le gaz butane,2017-06-23,"Le ministère délégué chargé des Affaires générales et de la Gouvernance a affirmé, jeudi, qu’il continuera à subventionner le gaz butane en vue de préserver la stabilité de son prix actuel et de pro"
Industrie manufacturière : 50% des patrons anticipent une hausse,2017-06-20,"La production industrielle manufacturière devrait connaitre une augmentation au 2è trimestre 2017 selon 50% des patrons d'entreprises, indique une enquête du Haut-Commissariat au Plan (HCP). Cette"
L'usine Peugeot-Citroën de Kénitra table sur une production annuelle de 200.000 véhicules,2017-06-16,"L'usine Peugeot-Citroën, dont les travaux ont été lancés à la zone franche de Kénitra (Atlantic free zone), table sur une production annuelle de 200.000 véhicules, a indiqué, jeudi à Kénitra, le min"
Un Marocain réussit à réduire les coûts d'utilisation des systèmes à énergie renouvelable,2017-06-14,"De l’électricité moins chère pour industriels À 27 ans, Karim El Alami développe une plateforme de gestion intelligente de l’énergie, produite et stockée localement par les industriels. Le but est d’"
"Le plan solaire ""Noor"" avance à grands pas",2017-06-14,"Le nouvel empire du soleil Grâce notamment à son plan solaire Noor, le Maroc pourra réduire de 13% ses émissions en gaz à effet de serre, responsables des changements climatiques en cours dans la pla"
Bank Al Maghrib pourchasse les impayés,2017-06-07,Les créances en souffrance des entreprises auprès des banques en hausse Bank Al Maghrib veut protéger les banques en proie à une hausse des créances en souffrance des entreprises. Mais comment relanc
MAMDA et MCMA deviennent ainsi un actionnaire de référence de la BCP,2017-06-06,"Aujourd’hui, les institutionnels locaux et étrangers représentent près de 30% du capital de la BCP. Ainsi, la MAMDA et la MCMA marquent une nouvelle étape dans leur stratégie d’investissement dans"
"La banque participative ""Umnia Bank"" désormais opérationnelle",2017-06-06,"Lancé depuis 2 ans, le projet de création d’Umnia Bank est aujourd’hui finalisé. En effet, la banque participative du groupe CIH est complètement opérationnelle techniquement pour pouvoir gérer les"
La conférence de la CEDEAO donne son accord de principe pour l'adhésion du Maroc,2017-06-05,"La Conférence de la Communauté économique des Etats de l’Afrique de l’Ouest (CEDEAO) a donné, dimanche à Monrovia, son accord de principe à la demande d’adhésion du Maroc à ce groupement régional."
Le plus grand porte-conteneurs au monde fait escale au port Tanger Med,2017-06-03,"Le plus grand porte-conteneurs au monde ""Madrid Maersk"" a fait sa première escale inaugurale en Afrique et en Méditerranée, vendredi à APM Terminals Tangier au port Tanger Med. Doté d'une capacité"
Un plan pour le développement du secteur du transport et de la logistique,2017-05-31,"Sitôt le salon du transport et de la logistique pour la méditerranée et pour l’Afrique a fermé ses portes le 19 mai, c’est vers d’autres événements que se tournent les regards des professionnels. C’"
Trois banques marocaines décrochent l'African Banker Awards 2017,2017-05-25,"Attijariwafa Bank, la Caisse Centrale de Garantie (CCG) et le Groupe Crédit Agricole viennent de remporter le prestigieux African Banker Awards 2017 dans différentes catégories. Attijariwafa Bank d"
Crédit du Maroc primé aux SABRE Awards Africa pour sa campagne #Maymkench,2017-05-23,Une distinction bien méritée La consécration du Crédit du Maroc renseigne sur la qualité de la communication en interne qui se reflète sur la communication externe de l’entreprise. La campagne de com
"Tanger, nouvel eldorado pour les entreprises espagnoles",2017-05-22,"La ville de Tanger est en passe de devenir le grand pôle économique du Maroc, constituant ainsi un nouvel ""eldorado"" pour les entreprises espagnoles, écrit le quotidien espagnol El Pais. Dans un do"
"Attijariwafa Bank lance Smart-Up, un programme d’open innovation",2017-05-19,"Mohamed El Kettani C’est un événement d’un genre nouveau lancé, ce vendredi 19 mai 2017, par le groupe Attijariwafa Bank. Ce programme international de l’Open Innovation, baptisé « Smart Up », s’éta"
INDH: Mobilisation de 40 milliards de DH durant la dernière décennie,2017-05-18,"Des fonds de l'ordre de 40 milliards de DH ont été investis au cours des dix dernières années dans le cadre de l'Initiative nationale pour le Développement Humain (INDH), a annoncé, jeudi à Fès, le"
La banque mondiale accorde un prêt de 350 millions de dollars au Maroc,2017-05-17,"La Banque mondiale (BM) a annoncé, mardi, qu'elle va accorder un prêt de 350 millions de dollars pour appuyer des réformes de grande ampleur dans le secteur de l’intermédiation financière au Maroc."
Le Maroc deviendra le premier pays non pétrolier de la région MENA à rejoindre le club des pays émergents,2017-05-17,"Le Maroc deviendra, au cours des prochaines décennies, le premier pays non producteur de pétrole de la région MENA à rejoindre le club des pays émergents, selon un rapport de la Banque mondiale (BM)"
"Interview de SALAH KOUBAA, professeur universitaire et économiste",2017-05-17,"SALAH KOUBAA, professeur universitaire et économiste Le dernier Mémorandum économique de la Banque mondiale consacré au Maroc, intitulé “Le Maroc à l’Horizon 2040: Capital Immatériel et Les Voies de"
Nigéria-Maroc: Signature des accords sur le Gazoduc et les engrais,2017-05-16,"Le roi Mohammed VI a présidé, lundi au palais royal à Rabat, la cérémonie de signature d’accords relatifs au projet du Gazoduc Nigéria-Maroc et à la coopération maroco-nigériane dans le domaine des"
La Chambre des représentants adopte à la majorité le PLF-2017,2017-05-13,"La Chambre des représentants a adopté, vendredi soir en séance plénière, à la majorité des voix le projet de loi de finances de l'année 2017. Le PLF-2017 a été adopté par 194 voix pour, 56 contre e"
Dix milliards de dirhams seront injectés aux 12 régions du Royaume,2017-05-11,"Un budget global de 10 milliards de dirhams sera injecté aux 12 régions du Royaume à l’horizon 2020, a fait savoir, mercredi à Fès, le ministre de l'Economie et des Finances, Mohamed Boussaid. Ces"
Le prix référentiel du blé rendu moulin fixé à 280 DH/quintal,2017-05-09,"Le prix référentiel du blé rendu moulin a été fixé à 280 DH/quintal (ql) pour une qualité standard, selon une décision conjointe visant la mise en place par le gouvernement de mesures dans le cadre"
Droit d’importation du blé: projet de loi adopté par la 1ère Chambre,2017-05-03,"La Chambre des représentants a adopté, mardi, à l’unanimité, lors d'une séance plénière, le projet de loi n°19-17 portant modification du droit d'importation applicable au blé tendre et ses dérivés."
El Othmani s'entretient avec le vice-ministre parlementaire japonais des Affaires étrangères,2017-05-03,"Le chef du gouvernement, Saâd Eddine El Othmani, s'est entretenu, mardi à Rabat, avec le vice-ministre parlementaire japonais des Affaires étrangères, Shunsuke Takei, qui effectue une visite de trav"
"ONCF, Barid Al Maghrib, 2M : Les nouveaux dossiers chauds de la Cour des comptes",2017-05-03,Driss Jettou Président de la Cour des comptes. Mohamed Rabie Khlie DG de l’ONCF. Mohamed Amine Benjelloun DG de Barid Al Maghrib Si le rapport est volumineux et touche plusieurs sphères de la gouver
Le Maroc invité d'honneur au Forum parlementaire de la CEDEAO,2017-05-02,"La Chambre des représentants participera en tant qu'invitée d'honneur au Forum parlementaire de la Communauté économique des Etats de l'Afrique de l'Ouest (CEDEAO) qui se tiendra, du 03 au 05 mai à"
Blé tendre : Le Maroc augmente les droits de douane à 135%,2017-04-27,"Le gouvernement marocain a décidé d’augmenter de 30% à 135% les droits de douane appliqués au blé tendre, et ce à partir de la publication de ce texte au Bulletin officiel, jusqu’à fin décembre 2017"
Gouvernement El Othmani : le projet de loi de finances 2017 en quelques chiffres,2017-04-27,"Présenté au conseil du gouvernement, ce jeudi 27 avril, le projet de loi de finances 2017 reflète les investissements du gouvernement au titre de l’année 2017. Ainsi un montant global de 190 millia"
"Entretien avec Danilo Annese, PDG de FCA Morocco",2017-04-25,"“Le Maroc représente pour FCA le plus grand marché en Afrique” Le groupe Fiat Chrysler Automobiles (FCA) Maroc a ouvert, mercredi 12 avril 2017 à Casablanca, l’un de ses plus grands showrooms"
Enquête 2017 du Global Entrepreneurship Monitor - Les freins à l'entreprenariat au Maroc,2017-04-25,Enquête 2017 du Global Entrepreneurship Monitor - Les freins à l'entreprenariat au Maroc
SIAM : un événement d'envergure nationale et internationale,2017-04-24,"La chaleur est étouffante ce mardi 18 avril 2017 dans la ville de Meknès, où s’ouvre la douzième édition du Salon international de l’agriculture au Maroc (SIAM). A l’extérieur des tentes abrita"
Le 12è SIAM ouvre ses portes au grand public,2017-04-21,"Après deux journées dédiées aux professionnels, le 12ème Salon international de l'agriculture au Maroc (SIAM), organisé du 18 au 23 avril à Meknès, a commencé à accueillir, vendredi matin, le grand"
SIAM 2017 : Le Prince Moulay Rachid préside la cérémonie de remise des prix,2017-04-21,"SAR le Prince Moulay Rachid a présidé, jeudi à Meknès, la cérémonie de remise des prix de signes distinctifs d'origine et de qualité ""produits de terroir"", de meilleures unités de production agricol"
TGV: le projet enregistre un taux d’avancement de 86%,2017-04-20,"Le projet de la première ligne à grande vitesse (LGV), qui reliera Tanger à Casablanca, est aujourd’hui en phase de préparation de l’exploitation, enregistrant un taux d’avancement global de 86% pou"
De moins en moins de recettes pour la presse écrite,2017-04-19,"Le marché publicitaire marocain estimé à 3,4 milliards de dirhams À quand un observatoire de la publicité au Maroc? Le besoin se fait tellement pressant que les estimations annoncées par tel ou t"
La qualité de service et d'hygiène parmi les failles nuisant à l'attractivité touristique du Maroc,2017-04-19,"Mohamed Sajid a du pain sur la planche Même si elle a régressé de trois places par rapport à 2015, l’attractivité touristique du Maroc se maintient dans une conjoncture plutôt défavorable marquée"
Ouverture officielle à Meknès de la 12è édition du Salon international de l'agriculture au Maroc,2017-04-18,"Le 12è Salon international de l'agriculture au Maroc (SIAM 2017), véritable vitrine sectorielle répondant aux attentes des professionnels et du grand public, a ouvert ses portes, mardi à Sahrij Soua"
Le plan stratégique 2018-2020 du groupe Addoha s'annonce sous les meilleurs auspices,2017-04-17,"Anas Sefrioui. - Un mot d’ordre, la performance Dans un secteur comme l’immobilier, qui passe par une conjoncture difficile, l’avenir ne peut que s’annoncer florissant pour un groupe aussi impor"
Ouverture à Meknès des 9è assises de l'agriculture,2017-04-17,"Les travaux des 9è Assises de l'agriculture, tenues sous le thème ""Agriculture et sécurité alimentaire au fil de l'eau"", se sont ouverts, lundi à Meknès, avec la participation de M. Alpha Condé, pré"
Le vin marocain de plus en plus tendance à l’international,2017-04-14,"Le Maroc commence à s’imposer comme un sérieux concurrent aux producteurs de vin de par le monde. C’est ce qu’a indiqué récemment Jean-Marie Aurand, directeur général de l'Organisation international"
"Café-CDM, nouvelle stratégie du Crédit du Maroc",2017-04-14,"Le top management du Crédit du Maroc a donné rendez-vous le jeudi 13 avril 2017 aux représentants des médias à la 3ème édition du Café-CDM, une rencontre officieuse et conviviale, au 24ème étage du So"
Neuvième assises de l'agriculture: Alpha Condé en invité d'honneur,2017-04-12,"© ph:DR Plus qu'un honneur: la participation du président guinéen Alpha Condé, par ailleurs président de l'Union africaine (UA), aux neuvièmes assises de l'agriculture est assurément un coup magistr"
"Interview de Fathia Bennis, présidente de Maroclear",2017-04-12,"“La dématérialisation des titres peut contribuer à la redynamisation de la Bourse” La présidente du dépositaire central, Maroclear, Fathia Bennis, multiplie les efforts pour inciter les sociétés maro"
Le Maroc a attiré 5.000 multimillionnaires en 2016,2017-04-11,"Le Maroc, a attiré en 2016 quelque 5.000 multimillionnaires contre 4000 l’année précédente. C’est ce qu’a relevé le cabinet d'études sud-africain New World Wealth, qui vient de publier sa dernière"
Casablanca Events&Animation expose son nouveau plan d'action pour la métropole,2017-04-10,"Du nouveau chez la société Casablanca Events&Animation, que dirige Mohamed Jouahri. Lors d’une rencontre avec la presse, mardi 4 avril 2017, à Casablanca, Toda Lotfi, directrice du développemen"
"Akhannouch décroche un don de 51,5 millions d’euros du Fonds Vert pour le Climat",2017-04-07,"Aziz Akhannouch, ministre de l’Agriculture, de la Pêche maritime, du Développement rural, des Eaux et Forêts Un don global de 51,5 millions d’euros a été accordé par le Fonds Vert pour le Climat (FV"
La consommation des ménages marocains en hausse de 4% au 1er trimestre 2017,2017-04-06,"CREDIT PHOTO : DR La consommation des ménages a augmenté de 4% au 1er trimestre 2017, contre 3,1%4è trimestre 2016, selon le Haut commissariat au plan. Cette hausse a ainsi contribué pour environ 2"
"Exclusif. Bank of Kigali : ""Nous sommes en train de négocier le rachat de la banque par la BCP""",2017-04-05,"Photo : BCP Comme nous l'avions détaillé dans un précédent article, Bank of Kigali est en train d'être rachetée par la Banque centrale populaire (BCP). C'est ce que nous a indiqué cette banque rwand"
"L'agence de notation moody's classe le royaume en «ba1», avec une perspective ""positive""",2017-04-05,"Abdellatif Jouahri, gouverneur de Bank Al Maghrib. Va-t-on vers le déblocage économique ? Lorsque la campagne agricole s’annonce sous de bons auspices avec une production record de pas moins de 78"
"Interview de Dirk De Nil, DG d'Allianz Maroc",2017-04-05,"""Le Maroc se positionne d’emblée comme un hub pour l’Afrique"" Maroc Hebdo: Que représente pour vous votre désignation en tant que groupe international de l’année en Afrique? Dirk De Nil: Pour nous,"
Vers une future implantation de la BCP au Rwanda ?,2017-04-05,"Le président-directeur général de la BCP, Mohamed Benchaâboun, au Nigéria lors de la visite royale dans le pays. Décembre 2016 - © ph:DR Sur son site web, l'hebdomadaire Challenge avait annoncé, le"
